{
  "schemaVersion": 1,
  "sourceStudentKey": "fixture_student",
  "sourceRevision": "fixture-rev-1",
  "generatedAt": "2026-09-01T09:00:00Z",
  "competencies": [
    {
      "competencyId": "algebra.linear",
      "title": "Линейные уравнения",
      "groupTitle": "Алгебра",
      "masteryLevel": 3,
      "sourceLessonDate": "2026-08-25",
      "sourceLessonHref": "25.08.26.html",
      "provider": "algebra.linear",
      "coverageStatus": "covered-generator"
    }
  ]
}
